{
  "$schema": "https://json-schema.org/draft/2020-12/schema",
  "$id": "https://example.local/schemas/device-command.v1.schema.json",
  "title": "DeviceCommand (MQTT) v1",
  "type": "object",
  "additionalProperties": false,
  "required": ["schema_version", "command_id", "device_id", "command_type", "payload", "issued_ts"],
  "properties": {
    "schema_version": { "type": "integer", "const": 1 },
    "command_id": {
      "type": "string",
      "pattern": "^[0-9a-fA-F]{8}-[0-9a-fA-F]{4}-[0-9a-fA-F]{4}-[0-9a-fA-F]{4}-[0-9a-fA-F]{12}$"
    },
    "device_id": {
      "type": "string",
      "pattern": "^[0-9a-fA-F]{8}-[0-9a-fA-F]{4}-[0-9a-fA-F]{4}-[0-9a-fA-F]{4}-[0-9a-fA-F]{12}$"
    },
    "command_type": { "type": "string" },
    "payload": { "type": "object", "additionalProperties": true },
    "issued_ts": { "type": "string", "format": "date-time" }
  }
}
