{
  "schema_version": 1,
  "command_id": "00000000-0000-4000-8000-000000002002",
  "device_id": "00000000-0000-0000-0000-000000000001",
  "command_type": "set_sampling_interval",
  "payload": {
    "source": "gateway-pretty-json",
    "intervalSeconds": 10
  },
  "issued_ts": "2026-03-26T14:01:00Z"
}
